roles/cloudtrace.user,  Cloud Trace User,  User access to Stackdriver Trace. Can view traces, insights and stats. Can create, list, view, and delete tasks.
roles/cloudtranslate.admin,  Cloud Translation API Admin,  Full access to all Cloud Translation resources
roles/cloudtranslate.editor,  Cloud Translation API Editor,  Editor of all Cloud Translation resources
roles/cloudtranslate.serviceAgent,  Cloud Translation API Service Agent,  Gives Cloud Translation Service Account access to consumer resources.
roles/cloudtranslate.user,  Cloud Translation API User,  User of Cloud Translation and AutoML models
roles/cloudtranslate.viewer,  Cloud Translation API Viewer,  Viewer of all Translation resources
roles/codelabapikeys.admin,  Codelab ApiKeys Admin,  Full access to API keys
roles/codelabapikeys.editor,  Codelab API Keys Editor,  This role can view and edit all properties of API keys.
roles/codelabapikeys.viewer,  Codelab API Keys Viewer,  This role can view all properties except change history of API keys.
roles/commerceoffercatalog.offersViewer,  Commerce Offer Catalog Offers Viewer,  Allows viewing offers
roles/commercepricemanagement.privateOffersAdmin,  Commerce Price Management Private Offers Admin,  Allows managing private offers
roles/commercepricemanagement.viewer,  Commerce Price Management Viewer,  Allows viewing offers, free trials, skus
roles/compliancescanning.ServiceAgent,  Compliance Scanning Service Agent,  Gives Compliance Scanning the access it needs to analyze containers and VMs for compliance and create occurrences using the Container Analysis API
roles/composer.ServiceAgentV2Ext,  Cloud Composer v2 API Service Agent Extension,  Cloud Composer v2 API Service Agent Extension is a supplementary role required to manage Composer v2 environments.
roles/composer.admin,  Composer Administrator,  Full control of Composer resources.
roles/composer.environmentAndStorageObjectAdmin,  Environment and Storage Object Administrator,  Full control of Cloud Composer environments and Cloud Storage objects.
roles/composer.environmentAndStorageObjectViewer,  Environment User and Storage Object Viewer,  Read access to Cloud Composer environments and Cloud Storage objects.
roles/composer.serviceAgent,  Cloud Composer API Service Agent,  Cloud Composer API service agent can manage environments.
roles/composer.sharedVpcAgent,  Composer Shared VPC Agent,  Role that should be assigned to Composer Agent service account in Shared VPC host project
roles/composer.user,  Composer User,  Read and use access to Composer resources.
roles/composer.worker,  Composer Worker,  Worker access to Composer. Intended for service accounts.
roles/compute.admin,  Compute Admin,  Full control of all Compute Engine resources.
roles/compute.imageUser,  Compute Image User,  Read and use image resources.
roles/compute.instanceAdmin,  Compute Instance Admin (beta),  Full control of Compute Engine instance resources.
roles/compute.instanceAdmin.v1,  Compute Instance Admin (v1),  Full control of Compute Engine instances, instance groups, disks, snapshots, and images. Read access to all Compute Engine networking resources.
roles/compute.loadBalancerAdmin,  Compute Load Balancer Admin,  Full control of Compute Engine resources related to load balancer.
roles/compute.networkAdmin,  Compute Network Admin,  Full control of Compute Engine networking resources.
roles/compute.networkUser,  Compute Network User,  Access to use Compute Engine networking resources.
roles/compute.networkViewer,  Compute Network Viewer,  Read-only access to Compute Engine networking resources.
roles/compute.orgFirewallPolicyAdmin,  Compute Organization Firewall Policy Admin,  Full control of Compute Engine Organization Firewall Policies.
roles/compute.orgFirewallPolicyUser,  Compute Organization Firewall Policy User,  View or use Compute Engine Firewall Policies to associate with the organization or folders.
roles/compute.orgSecurityPolicyAdmin,  Compute Organization Security Policy Admin,  Full control of Compute Engine Organization Security Policies.
roles/compute.orgSecurityPolicyUser,  Compute Organization Security Policy User,  View or use Compute Engine Security Policies to associate with the organization or folders.
roles/compute.orgSecurityResourceAdmin,  Compute Organization Resource Admin,  Full control of Compute Engine Firewall Policy associations to the organization or folders.
roles/compute.osAdminLogin,  Compute OS Admin Login,  Access to log in to a Compute Engine instance as an administrator user.
roles/compute.osLogin,  Compute OS Login,  Access to log in to a Compute Engine instance as a standard (non-administrator) user.
roles/compute.osLoginExternalUser,  Compute OS Login External User,  Access for an external user to set OS Login information associated with this organization. This role does not grant access to instances. External users must be granted one of the required OS Login IAM roles (https://cloud.google.com/compute/docs/instances/managing-instance-access#configure_users) in order to allow access to instances using SSH.
roles/compute.packetMirroringAdmin,  Compute packet mirroring admin,  Specify resources to be mirrored.
roles/compute.packetMirroringUser,  Compute packet mirroring user,  Use Compute Engine packet mirrorings.
roles/compute.publicIpAdmin,  Compute Public IP Admin,  Full control of public IP address management for Compute Engine.
roles/compute.securityAdmin,  Compute Security Admin,  Full control of Compute Engine security resources.
roles/compute.serviceAgent,  Compute Engine Service Agent,  Gives Compute Engine Service Account access to assert service account authority. Includes access to service accounts.
roles/compute.storageAdmin,  Compute Storage Admin,  Full control of Compute Engine storage resources.
roles/compute.viewer,  Compute Viewer,  Read-only access to get and list information about all Compute Engine resources, including instances, disks, and firewalls. Allows getting and listing information about disks, images, and snapshots, but does not allow reading the data stored on them.
roles/compute.xpnAdmin,  Compute Shared VPC Admin,  Can administer shared VPC network (XPN).
roles/consumerprocurement.entitlementManager,  Consumer Procurement Entitlement Manager,  Allows managing entitlements and enabling, disabling, and inspecting service states for a consumer project
roles/consumerprocurement.entitlementViewer,  Consumer Procurement Entitlement Viewer,  Allows inspecting entitlements and service states for a consumer project
roles/consumerprocurement.orderAdmin,  Consumer Procurement Order Administrator,  Allows managing purchases
roles/consumerprocurement.orderViewer,  Consumer Procurement Order Viewer,  Allows inspecting purchases
roles/contactcenterinsights.editor,  Contact Center AI Insights editor,  Grants read and write access to all Contact Center AI Insights resources.
roles/contactcenterinsights.serviceAgent,  Contact Center AI Insights Service Agent,  Allows Contact Center AI to read and write APIs including BigQuery, Dialogflow, and Storage.
roles/contactcenterinsights.viewer,  Contact Center AI Insights viewer,  Grants read access to all Contact Center AI Insights resources.
roles/container.admin,  Kubernetes Engine Admin,  Full management of Kubernetes Clusters and their Kubernetes API objects.
roles/container.clusterAdmin,  Kubernetes Engine Cluster Admin,  Management of Kubernetes Clusters.
roles/container.clusterViewer,  Kubernetes Engine Cluster Viewer,  Get and list access to GKE Clusters.
roles/container.developer,  Kubernetes Engine Developer,  Full access to Kubernetes API objects inside Kubernetes Clusters.
roles/container.hostServiceAgentUser,  Kubernetes Engine Host Service Agent User,  Allows the Kubernetes Engine service account in the host project to configure shared network resources for cluster management. Also gives access to inspect the firewall rules in the host project, and configure Cloud DNS resources.
roles/container.serviceAgent,  Kubernetes Engine Service Agent,  Gives Kubernetes Engine account access to manage cluster resources. Includes access to service accounts.
roles/container.viewer,  Kubernetes Engine Viewer,  Read-only access to Kubernetes Engine resources.
roles/containeranalysis.ServiceAgent,  Container Analysis Service Agent,  Gives Container Analysis API the access it needs to function
roles/containeranalysis.admin,  Container Analysis Admin,  Access to all Container Analysis resources.
roles/containeranalysis.notes.attacher,  Container Analysis Notes Attacher,  Can attach Container Analysis Occurrences to Notes.
roles/containeranalysis.notes.editor,  Container Analysis Notes Editor,  Can edit Container Analysis Notes.
roles/containeranalysis.notes.occurrences.viewer,  Container Analysis Occurrences for Notes Viewer,  Can view all Container Analysis Occurrences attached to a Note.
roles/containeranalysis.notes.viewer,  Container Analysis Notes Viewer,  Can view Container Analysis Notes.
roles/containeranalysis.occurrences.editor,  Container Analysis Occurrences Editor,  Can edit Container Analysis Occurrences.
roles/containeranalysis.occurrences.viewer,  Container Analysis Occurrences Viewer,  Can view Container Analysis Occurrences.
roles/containerregistry.ServiceAgent,  Container Registry Service Agent,  Access for Container Registry
roles/containerscanning.ServiceAgent,  Container Scanner Service Agent,  Gives Container Scanner the access it needs to analyzecontainers for vulnerabilities and create occurrences using the Container Analysis API
roles/containerthreatdetection.serviceAgent,  Container Threat Detection Service Agent,  Gives Container Threat Detection service account access to enable/disable Container Threat Detection and manage the Container Threat Detection Agent on Google Kubernetes Engine clusters.
roles/contentwarehouse.serviceAgent,  Content Warehouse Service Agent,  Gives the Content Warehouse service account to manage customer resources
roles/datacatalog.admin,  Data Catalog Admin,  Full access to all DataCatalog resources
roles/datacatalog.categoryAdmin,  Policy Tag Admin,  Manage taxonomies
roles/datacatalog.categoryFineGrainedReader,  Fine-Grained Reader,  Read access to sub-resources tagged by a policy tag, for example, BigQuery columns
roles/datacatalog.entryGroupCreator,  DataCatalog EntryGroup Creator,  Can create new entryGroups
roles/datacatalog.entryGroupOwner,  DataCatalog entryGroup Owner,  Full access to entryGroups
roles/datacatalog.entryOwner,  DataCatalog entry Owner,  Full access to entries
roles/datacatalog.entryViewer,  DataCatalog Entry Viewer,  Read access to entries
roles/datacatalog.tagEditor,  Data Catalog Tag Editor,  Gives permission to modify tags on a GCP assets (BigQuery, Pub/Sub etc).
roles/datacatalog.tagTemplateCreator,  Data Catalog TagTemplate Creator,  Access to create new tag templates
roles/datacatalog.tagTemplateOwner,  Data Catalog TagTemplate Owner,  Full acess to tag templates
roles/datacatalog.tagTemplateUser,  Data Catalog TagTemplate User,  Access to use templates to tag resources
roles/datacatalog.tagTemplateViewer,  Data Catalog TagTemplate Viewer,  Read access to templates and tags created using the templates
roles/datacatalog.viewer,  Data Catalog Viewer,  Grants metadata read permissions to cataloged GCP assets (BigQuery, Pub/Sub etc)
roles/dataflow.admin,  Dataflow Admin,  Minimal role for creating and managing dataflow jobs.
roles/dataflow.developer,  Dataflow Developer,  Full operational access to Dataflow jobs.
roles/dataflow.serviceAgent,  Cloud Dataflow Service Agent,  Gives Cloud Dataflow service account access to managed resources. Includes access to service accounts.
roles/dataflow.viewer,  Dataflow Viewer,  Read only access to Dataflow jobs.
roles/dataflow.worker,  Dataflow Worker,  Worker access to Dataflow.  Intended for service accounts.
roles/datafusion.admin,  Cloud Data Fusion Admin,  Full access to Cloud Data Fusion Instances, Namespaces and related resources.
roles/datafusion.runner,  Cloud Data Fusion Runner,  Access to Cloud Data Fusion runtime resources.
roles/datafusion.serviceAgent,  Cloud Data Fusion API Service Agent,  Gives Cloud Data Fusion service account access to Service Networking, Cloud Dataproc, Cloud Storage, BigQuery, Cloud Spanner, and Cloud Bigtable resources.
roles/datafusion.viewer,  Cloud Data Fusion Viewer,  Read-only access to Cloud Data Fusion Instances, Namespaces and related resources.
roles/datalabeling.admin,  Data Labeling Service Admin,  Full access to all Data Labeling resources
roles/datalabeling.editor,  Data Labeling Service Editor,  Editor of all Data Labeling resources
roles/datalabeling.serviceAgent,  Data Labeling Service Agent,  Gives Data Labeling service account read/write access to Cloud Storage, read/write BigQuery, update CMLE model versions, editor access to Annotation service and AutoML service.
roles/datalabeling.viewer,  Data Labeling Service Viewer,  Viewer of all Data Labeling resources
roles/datamigration.admin,  Database Migration Admin,  Full access to all resources of Database Migration.
roles/datapipelines.admin,  Data pipelines Admin,  Administrator of datapipelines resources
roles/datapipelines.invoker,  Data pipelines Invoker,  Invoker of datapipelines jobs
roles/datapipelines.serviceAgent,  Datapipelines Service Agent,  Gives Datapipelines service permissions to create Dataflow & Cloud Scheduler jobs in the user project.
roles/datapipelines.viewer,  Data pipelines Viewer,  Viewer of datapipelines resources
roles/dataprep.projects.user,  Dataprep User,  Use of Dataprep.
roles/dataprep.serviceAgent,  Dataprep Service Agent,  Dataprep service identity. Includes access to service accounts.
roles/dataproc.admin,  Dataproc Administrator,  Full control of Dataproc resources.
roles/dataproc.editor,  Dataproc Editor,  Full control of Dataproc resources. Allows viewing all networks.
roles/dataproc.hubAgent,  Dataproc Hub Agent,  Allows management of Dataproc resources. Intended for service accounts running Dataproc Hub instances.
roles/dataproc.serviceAgent,  Dataproc Service Agent,  Gives Cloud Dataproc service account access to Compute, and Storage resources and Service Accounts.
roles/dataproc.viewer,  Dataproc Viewer,  Read-only access to Dataproc resources.
roles/dataproc.worker,  Dataproc Worker,  Worker access to Dataproc. Intended for service accounts.
roles/dataprocessing.admin,  Data Processing Controls Resource Admin,  Data processing controls admin who can fully manage data processing controls settings and view all datasource data.
roles/datastore.importExportAdmin,  Cloud Datastore Import Export Admin,  Full access to manage imports and exports.
roles/datastore.indexAdmin,  Cloud Datastore Index Admin,  Full access to manage index definitions.
roles/datastore.owner,  Cloud Datastore Owner,  Full access to Cloud Datastore.
roles/datastore.user,  Cloud Datastore User,  Provides read/write access to data in a Cloud Datastore database. Intended for application developers and service accounts.
roles/datastore.viewer,  Cloud Datastore Viewer,  Read access to all Cloud Datastore resources.
roles/datastream.admin,  Datastream Admin,  Full access to all Datastream resources.
roles/datastream.viewer,  Datastream Viewer,  Read-only access to all Datastream resources.
roles/datastudio.serviceAgent,  Data Studio Service Agent,  Grants Data Studio Service Account access to manage resources.
roles/dellemccloudonefs.admin,  Dell EMC Cloud OneFS Admin,  This role is managed by Dell EMC, not Google.
roles/dellemccloudonefs.user,  Dell EMC Cloud OneFS User,  This role is managed by Dell EMC, not Google.
roles/dellemccloudonefs.viewer,  Dell EMC Cloud OneFS Viewer,  This role is managed by Dell EMC, not Google.
roles/deploymentmanager.editor,  Deployment Manager Editor,  Read and Write access to all Deployment Manager resources.
roles/deploymentmanager.typeEditor,  Deployment Manager Type Editor,  Read and Write access to all Type Registry resources.
roles/deploymentmanager.typeViewer,  Deployment Manager Type Viewer,  Read-only access to all Type Registry resources.
roles/deploymentmanager.viewer,  Deployment Manager Viewer,  Read-only access to all Deployment Manager resources.
roles/dialogflow.aamAdmin,  AAM Admin,  An admin has access to all resources and can perform all administrative actions in an AAM project.
roles/dialogflow.aamConversationalArchitect,  AAM Conversational Architect,  A Conversational Architect can label conversational data, approve taxonomy changes and design virtual agents for a customer's use cases.
roles/dialogflow.aamDialogDesigner,  AAM Dialog Designer,  A Dialog Designer can label conversational data and propose taxonomy changes for virtual agent modeling.
roles/dialogflow.aamLeadDialogDesigner,  AAM Lead Dialog Designer,  A Dialog Designer Lead can label conversational data and approve taxonomy changes for virtual agent modeling.
roles/dialogflow.aamViewer,  AAM Viewer,  A user can view the taxonomy and data reports in an AAM project.
roles/dialogflow.admin,  Dialogflow API Admin,  Can query for intent; read & write session properties; read & write agent properties.
roles/dialogflow.client,  Dialogflow API Client,  Can call all methods on sessions and conversations resources as well as their descendants.
roles/dialogflow.consoleAgentEditor,  Dialogflow Console Agent Editor,  Can edit agent in Dialogflow Console
roles/dialogflow.consoleSimulatorUser,  Dialogflow Console Simulator User,  Can perform query of dialogflow suggestions in the simulator in web console.
roles/dialogflow.consoleSmartMessagingAllowlistEditor,  Dialogflow Console Smart Messaging Allowlist Editor,  Can edit allowlist for smart messaging associated with conversation model in the agent assist console
roles/dialogflow.conversationManager,  Dialogflow Conversation Manager,  Can manage all the resources related to Dialogflow Conversations.
roles/dialogflow.entityTypeAdmin,  Dialogflow Entity Type Admin,  Can read & write entity types.
roles/dialogflow.environmentEditor,  Dialogflow Environment editor,  Can read & update environment and its sub-resources.
roles/dialogflow.flowEditor,  Dialogflow Flow editor,  Can read & update flow and its sub-resources.
roles/dialogflow.integrationManager,  Dialogflow Integration Manager,  Can add, remove, enable and disable Dialogflow integrations.
roles/dialogflow.intentAdmin,  Dialogflow Intent Admin,  Can read & write intents.
roles/dialogflow.reader,  Dialogflow API Reader,  Can read agent and session properties; cannot query for intent.
roles/dialogflow.serviceAgent,  Dialogflow Service Agent,  Gives Dialogflow Service Account access to resources on behalf of user project for intent detection in integrations (Facebook Messenger, Slack, Telephony, etc.).
roles/dialogflow.testCaseAdmin,  Dialogflow Test Case Admin,  Can read & write test cases.
roles/dialogflow.webhookAdmin,  Dialogflow Webhook Admin,  Can read & write webhooks.
roles/dlp.admin,  DLP Administrator,  Administer DLP including jobs and templates.
roles/dlp.analyzeRiskTemplatesEditor,  DLP Analyze Risk Templates Editor,  Edit DLP analyze risk templates.
roles/dlp.analyzeRiskTemplatesReader,  DLP Analyze Risk Templates Reader,  Read DLP analyze risk templates.
roles/dlp.columnDataProfilesReader,  DLP Column Data Profiles Reader,  Read DLP column profiles.
roles/dlp.dataProfilesReader,  DLP Data Profiles Reader,  Read DLP profiles.
roles/dlp.deidentifyTemplatesEditor,  DLP De-identify Templates Editor,  Edit DLP de-identify templates.
roles/dlp.deidentifyTemplatesReader,  DLP De-identify Templates Reader,  Read DLP de-identify templates.
roles/dlp.estimatesAdmin,  DLP Cost Estimation,  Manage DLP Cost Estimates.
roles/dlp.inspectFindingsReader,  DLP Inspect Findings Reader,  Read DLP stored findings.
roles/dlp.inspectTemplatesEditor,  DLP Inspect Templates Editor,  Edit DLP inspect templates.
roles/dlp.inspectTemplatesReader,  DLP Inspect Templates Reader,  Read DLP inspect templates.
roles/dlp.jobTriggersEditor,  DLP Job Triggers Editor,  Edit job triggers configurations.
roles/dlp.jobTriggersReader,  DLP Job Triggers Reader,  Read job triggers.
roles/dlp.jobsEditor,  DLP Jobs Editor,  Edit and create jobs
roles/dlp.jobsReader,  DLP Jobs Reader,  Read jobs
roles/dlp.orgdriver,  DLP Organization Data Profiles Driver,  Permissions needed by the DLP service account to generate data profiles within an organization or folder.
roles/dlp.projectDataProfilesReader,  DLP Project Data Profiles Reader,  Read DLP project profiles.
roles/dlp.projectdriver,  DLP Project Data Profiles Driver,  Permissions needed by the DLP service account to generate data profiles within a project.
roles/dlp.reader,  DLP Reader,  Read DLP entities, such as jobs and templates.
roles/dlp.serviceAgent,  DLP API Service Agent,  Gives Cloud DLP service agent permissions for BigQuery, Cloud Storage, Datastore, Pub/Sub and Cloud KMS.
roles/dlp.storedInfoTypesEditor,  DLP Stored InfoTypes Editor,  Edit DLP stored info types.
roles/dlp.storedInfoTypesReader,  DLP Stored InfoTypes Reader,  Read DLP stored info types.
roles/dlp.tableDataProfilesReader,  DLP Table Data Profiles Reader,  Read DLP table profiles.
roles/dlp.user,  DLP User,  Inspect, Redact, and De-identify Content
roles/dns.admin,  DNS Administrator,  Full read-write access to DNS resources.
roles/dns.peer,  DNS Peer,  Access to target networks with DNS peering zones
roles/dns.reader,  DNS Reader,  Read-only access to DNS resources.
roles/documentai.admin,  Cloud DocumentAI Administrator.,  Grants full access to all resources in Cloud DocumentAI
roles/documentai.apiUser,  Cloud DocumentAI API User,  Grants access to process documents in Cloud DocumentAI
roles/documentai.editor,  Cloud DocumentAI Editor,  Grants access to use all resources in Cloud DocumentAI
roles/documentai.viewer,  Cloud DocumentAI Viewer,  Grants access to view all resources and process documents in Cloud DocumentAI
roles/documentaicore.serviceAgent,  DocumentAI Core Service Agent,  Gives DocumentAI Core Service Account access to consumer resources.
roles/domains.admin,  Cloud Domains Admin,  Full access to Cloud Domains Registrations and related resources.
roles/domains.viewer,  Cloud Domains Viewer,  Read-only access to Cloud Domains Registrations and related resources.
roles/earlyaccesscenter.admin,  Early Access Center Administrator,  Grants full access to the Early Access Center, including access to all DATA_READ and DATA_WRITE permissions. Including the ability to enroll into Early Access Campaigns.
roles/earlyaccesscenter.viewer,  Early Access Center Viewer,  Grants view access to the Early Access Center, including access to all DATA_READ but no DATA_WRITE permissions.
roles/earthengine.admin,  Earth Engine Resource Admin,  Full access to all Earth Engine resource features
roles/earthengine.appsPublisher,  Earth Engine Apps Publisher,  Publisher of Earth Engine Apps
roles/earthengine.viewer,  Earth Engine Resource Viewer,  Viewer of all Earth Engine resources
roles/earthengine.writer,  Earth Engine Resource Writer,  Writer of all Earth Engine resources
roles/editor,  Editor,  Edit access to all resources.
roles/endpoints.portalAdmin,  Endpoints Portal Admin,  Full access to Endpoints Portal resources
roles/endpoints.serviceAgent,  Cloud Endpoints Service Agent,  Gives the Cloud Endpoints service account access to Endpoints services and the ability to act as a service controller.
roles/endpointsportal.serviceAgent,  Endpoints Portal Service Agent,  Can access information about Endpoints services for consumer portal management, and can read Source Repositories for consumer portal custom content.
roles/enterpriseknowledgegraph.serviceAgent,  Enterprise Knowledge Graph Service Agent,  Gives Enterprise Knowledge Graph Service Account access to consumer resources.
roles/errorreporting.admin,  Error Reporting Admin,  Administrative access to Error Reporting.
roles/errorreporting.user,  Error Reporting User,  User access to Error Reporting. Can list all errors and update their metadata. Can delete error events.
roles/errorreporting.viewer,  Error Reporting Viewer,  Read-only access to all Error Reporting data.
roles/errorreporting.writer,  Error Reporting Writer,  Can send error events to Error Reporting. Intended for service accounts.
roles/essentialcontacts.admin,  Essential Contacts Admin,  Full access to all essential contacts
roles/essentialcontacts.viewer,  Essential Contacts Viewer,  Viewer for all essential contacts
roles/eventarc.admin,  Eventarc Admin,  Full control over all Eventarc resources.
roles/eventarc.developer,  Eventarc Developer,  Access to read and write Eventarc resources.
roles/eventarc.eventReceiver,  Eventarc Event Receiver,  Can receive events from all event providers.
roles/eventarc.serviceAgent,  Eventarc Service Agent,  Gives Eventarc service account access to managed resources.
roles/eventarc.viewer,  Eventarc Viewer,  Can view the state of all Eventarc resources, including IAM policies.
roles/file.editor,  Cloud Filestore Editor,  Read-write access to Filestore instances and related resources.
roles/file.serviceAgent,  Cloud Filestore Service Agent,  Gives Cloud Filestore service account access to managed resources.
roles/file.viewer,  Cloud Filestore Viewer,  Read-only access to Filestore instances and related resources.
roles/firebase.admin,  Firebase Admin,  Full access to Firebase products.
roles/firebase.analyticsAdmin,  Firebase Analytics Admin,  Full access to Google Analytics for Firebase.
roles/firebase.analyticsViewer,  Firebase Analytics Viewer,  Read access to Google Analytics for Firebase.
roles/firebase.appDistributionSdkServiceAgent,  Firebase App Distribution Admin SDK Service Agent,  Read and write access to Firebase App Distribution with the Admin SDK
roles/firebase.developAdmin,  Firebase Develop Admin,  Full access to Firebase Develop products and Analytics.
