roles/firebase.developViewer,  Firebase Develop Viewer,  Read access to Firebase Develop products and Analytics.
roles/firebase.growthAdmin,  Firebase Grow Admin,  Full access to Firebase Grow products and Analytics.
roles/firebase.growthViewer,  Firebase Grow Viewer,  Read access to Firebase Grow products and Analytics.
roles/firebase.managementServiceAgent,  Firebase Service Management Service Agent,  Access to create new service agents for Firebase projects; assign roles to service agents; provision GCP resources as required by Firebase services.
roles/firebase.qualityAdmin,  Firebase Quality Admin,  Full access to Firebase Quality products and Analytics.
roles/firebase.qualityViewer,  Firebase Quality Viewer,  Read access to Firebase Quality products and Analytics.
roles/firebase.sdkAdminServiceAgent,  Firebase Admin SDK Administrator Service Agent,  Read and write access to Firebase products available in the Admin SDK
roles/firebase.sdkProvisioningServiceAgent,  Firebase SDK Provisioning Service Agent,  Access to provision apps with the Admin SDK.
roles/firebase.viewer,  Firebase Viewer,  Read-only access to Firebase products.
roles/firebaseabt.admin,  Firebase A/B Testing Admin,  Full read/write access to Firebase A/B Testing resources.
roles/firebaseabt.viewer,  Firebase A/B Testing Viewer,  Read-only access to Firebase A/B Testing resources.
roles/firebaseappcheck.admin,  Firebase App Check Admin,  Full management of Firebase App Check.
roles/firebaseappcheck.viewer,  Firebase App Check Viewer,  Read-only access for Firebase App Check.
roles/firebaseappdistro.admin,  Firebase App Distribution Admin,  Full read/write access to Firebase App Distribution resources.
roles/firebaseappdistro.viewer,  Firebase App Distribution Viewer,  Read-only access to Firebase App Distribution resources.
roles/firebaseauth.admin,  Firebase Authentication Admin,  Full read/write access to Firebase Authentication resources.
roles/firebaseauth.viewer,  Firebase Authentication Viewer,  Read-only access to Firebase Authentication resources.
roles/firebasecrash.symbolMappingsAdmin,  Firebase Crash Symbol Uploader,  Full read/write access to symbol mapping file resources for Firebase Crash Reporting.
roles/firebasecrashlytics.admin,  Firebase Crashlytics Admin,  Full read/write access to Firebase Crashlytics resources.
roles/firebasecrashlytics.viewer,  Firebase Crashlytics Viewer,  Read-only access to Firebase Crashlytics resources.
roles/firebasedatabase.admin,  Firebase Realtime Database Admin,  Full read/write access to Firebase Realtime Database resources.
roles/firebasedatabase.viewer,  Firebase Realtime Database Viewer,  Read-only access to Firebase Realtime Database resources.
roles/firebasedynamiclinks.admin,  Firebase Dynamic Links Admin,  Full read/write access to Firebase Dynamic Links resources.
roles/firebasedynamiclinks.viewer,  Firebase Dynamic Links Viewer,  Read-only access to Firebase Dynamic Links resources.
roles/firebasehosting.admin,  Firebase Hosting Admin,  Full read/write access to Firebase Hosting resources.
roles/firebasehosting.viewer,  Firebase Hosting Viewer,  Read-only access to Firebase Hosting resources.
roles/firebaseinappmessaging.admin,  Firebase In-App Messaging Admin,  Full read/write access to Firebase In-App Messaging resources.
roles/firebaseinappmessaging.viewer,  Firebase In-App Messaging Viewer,  Read-only access to Firebase In-App Messaging resources.
roles/firebaseml.admin,  Firebase ML Kit Admin,  Full read/write access to Firebase ML Kit resources.
roles/firebaseml.viewer,  Firebase ML Kit Viewer,  Read-only access to Firebase ML Kit resources.
roles/firebasemods.serviceAgent,  Firebase Extensions API Service Agent,  Grants Firebase Extensions API Service Account access to manage resources.
roles/firebasenotifications.admin,  Firebase Cloud Messaging Admin,  Full read/write access to Firebase Cloud Messaging resources.
roles/firebasenotifications.viewer,  Firebase Cloud Messaging Viewer,  Read-only access to Firebase Cloud Messaging resources.
roles/firebaseperformance.admin,  Firebase Performance Reporting Admin,  Full access to firebaseperformance resources.
roles/firebaseperformance.viewer,  Firebase Performance Reporting Viewer,  Read-only access to firebaseperformance resources.
roles/firebasepredictions.admin,  Firebase Predictions Admin,  Full read/write access to Firebase Predictions resources.
roles/firebasepredictions.viewer,  Firebase Predictions Viewer,  Read-only access to Firebase Predictions resources.
roles/firebaserules.admin,  Firebase Rules Admin,  Full management of Firebase Rules.
roles/firebaserules.viewer,  Firebase Rules Viewer,  Read-only access on all resources with the ability to test Rulesets.
roles/firebasestorage.admin,  Cloud Storage for Firebase Admin,  Full management of Cloud Storage for Firebase.
roles/firebasestorage.serviceAgent,  Cloud Storage for Firebase Service Agent,  Access to Cloud Storage for Firebase through API and SDK.
roles/firebasestorage.viewer,  Cloud Storage for Firebase Viewer,  Read-only access for Cloud Storage for Firebase.
roles/firestore.serviceAgent,  Firestore Service Agent,  Gives Firestore service account access to managed resources.
roles/firewallinsights.serviceAgent,  Cloud Firewall Insights Service Agent,  Gives Cloud Firewall Insights service agent permissions to retrieve Firewall, VM and route resources on user behalf.
roles/fleetengine.serviceAgent,  FleetEngine Service Agent,  Grants the FleetEngine Service Account access to manage resources.
roles/gameservices.admin,  Game Services API Admin,  Full access to Game Services API and related resources.
roles/gameservices.serviceAgent,  Game Services Service Agent,  Gives Game Services Service Account access to GCP resources.
roles/gameservices.viewer,  Game Services API Viewer,  Read-only access to Game Services API and related resources.
roles/genomics.admin,  Genomics Admin,  Full access to genomics datasets and operations.
roles/genomics.editor,  Genomics Editor,  Access to read and edit genomics datasets and operations.
roles/genomics.pipelinesRunner,  Genomics Pipelines Runner,  Full access to operate on genomics pipelines.
roles/genomics.serviceAgent,  Genomics Service Agent,  Gives Genomics Service Account access to compute resources. Includes access to service accounts.
roles/genomics.viewer,  Genomics Viewer,  Access to view genomics datasets and operations.
roles/gkehub.admin,  GKE Hub Admin,  Full access to GKE Hub resources.
roles/gkehub.connect,  GKE Connect Agent,  Ability to set up GKE Connect between external clusters and Google.
roles/gkehub.gatewayAdmin,  Connect Gateway Admin,  Full access to Connect Gateway.
roles/gkehub.serviceAgent,  GKE Hub Service Agent,  Gives the GKE Hub service agent access to Cloud Platform resources.
roles/gkehub.viewer,  GKE Hub Viewer,  Read-only access to GKE Hubs and related resources.
roles/gkemulticloud.admin,  Anthos Multi-cloud Admin,  Administrator of Anthos Multi-cloud resources
roles/gkemulticloud.serviceAgent,  Anthos Multi-Cloud Service Agent,  Grants the Anthos Multi-Cloud Service Account access to manage resources.
roles/gkemulticloud.viewer,  Anthos Multi-cloud Viewer,  Viewer of Anthos Multi-cloud resources
roles/gsuiteaddons.developer,  Google Workspace Add-ons Developer,  Full access to Google Workspace Add-ons resources
roles/gsuiteaddons.reader,  Google Workspace Add-ons Reader,  Read-only access to Google Workspace Add-ons resources
roles/gsuiteaddons.tester,  Google Workspace Add-ons Tester,  Testing execution access to Google Workspace Add-ons resources
roles/healthcare.annotationEditor,  Healthcare Annotation Editor,  Create, delete, update, read and list annotations.
roles/healthcare.annotationReader,  Healthcare Annotation Reader,  Read and list annotations in an Annotation store.
roles/healthcare.annotationStoreAdmin,  Healthcare Annotation Administrator,  Administer Annotation stores.
roles/healthcare.annotationStoreViewer,  Healthcare Annotation Store Viewer,  List Annotation Stores in a dataset.
roles/healthcare.attributeDefinitionEditor,  Healthcare Attribute Definition Editor,  Edit AttributeDefinition objects.
roles/healthcare.attributeDefinitionReader,  Healthcare Attribute Definition Reader,  Read AttributeDefinition objects in a consent store.
roles/healthcare.consentArtifactAdmin,  Healthcare Consent Artifact Administrator,  Administer ConsentArtifact objects.
roles/healthcare.consentArtifactEditor,  Healthcare Consent Artifact Editor,  Edit ConsentArtifact objects.
roles/healthcare.consentArtifactReader,  Healthcare Consent Artifact Reader,  Read ConsentArtifact objects in a consent store.
roles/healthcare.consentEditor,  Healthcare Consent Editor,  Edit Consent objects.
roles/healthcare.consentReader,  Healthcare Consent Reader,  Read Consent objects in a consent store.
roles/healthcare.consentStoreAdmin,  Healthcare Consent Store Administrator,  Administer Consent stores.
roles/healthcare.consentStoreViewer,  Healthcare Consent Store Viewer,  List Consent Stores in a dataset.
roles/healthcare.datasetAdmin,  Healthcare Dataset Administrator,  Administer Healthcare Datasets.
roles/healthcare.datasetViewer,  Healthcare Dataset Viewer,  List the Healthcare Datasets in a project.
roles/healthcare.dicomEditor,  Healthcare DICOM Editor,  Edit DICOM images individually and in bulk.
roles/healthcare.dicomStoreAdmin,  Healthcare DICOM Store Administrator,  Administer DICOM stores.
roles/healthcare.dicomStoreViewer,  Healthcare DICOM Store Viewer,  List DICOM Stores in a dataset.
roles/healthcare.dicomViewer,  Healthcare DICOM Viewer,  Retrieve DICOM images from a DICOM store.
roles/healthcare.fhirResourceEditor,  Healthcare FHIR Resource Editor,  Create, delete, update, read and search FHIR resources.
roles/healthcare.fhirResourceReader,  Healthcare FHIR Resource Reader,  Read and search FHIR resources.
roles/healthcare.fhirStoreAdmin,  Healthcare FHIR Store Administrator,  Administer FHIR resource stores.
roles/healthcare.fhirStoreViewer,  Healthcare FHIR Store Viewer,  List FHIR Stores in a dataset.
roles/healthcare.hl7V2Consumer,  Healthcare HL7v2 Message Consumer,  List and read HL7v2 messages, update message labels, and publish new messages.
roles/healthcare.hl7V2Editor,  Healthcare HL7v2 Message Editor,  Read, write, and delete access to HL7v2 messages.
roles/healthcare.hl7V2Ingest,  Healthcare HL7v2 Message Ingest,  Ingest HL7v2 messages received from a source network.
roles/healthcare.hl7V2StoreAdmin,  Healthcare HL7v2 Store Administrator,  Administer HL7v2 Stores.
roles/healthcare.hl7V2StoreViewer,  Healthcare HL7v2 Store Viewer,  View HL7v2 Stores in a dataset.
roles/healthcare.nlpServiceViewer,  Healthcare NLP Service Viewer,  Extract and analyze medical entities from a given text.
roles/healthcare.serviceAgent,  Healthcare Service Agent,  Gives the Healthcare Service Account access to networks,Kubernetes engine, and pubsub resources.
roles/healthcare.userDataMappingEditor,  Healthcare User Data Mapping Editor,  Edit UserDataMapping objects.
roles/healthcare.userDataMappingReader,  Healthcare User Data Mapping Reader,  Read UserDataMapping objects in a consent store.
roles/iam.organizationRoleAdmin,  Organization Role Administrator,  Access to administer all custom roles in the organization and the projects below it.
roles/iam.organizationRoleViewer,  Organization Role Viewer,  Read access to all custom roles in the organization and the projects below it.
roles/iam.roleAdmin,  Role Administrator,  Access to administer all custom roles in the project.
roles/iam.roleViewer,  Role Viewer,  Read access to all custom roles in the project.
roles/iam.securityAdmin,  Security Admin,  Security admin role, with permissions to get and set any IAM policy.
roles/iam.securityReviewer,  Security Reviewer,  Security reviewer role, with permissions to get any IAM policy.
	roles/iam.serviceAccountAdmin,  Service Account Admin,  Create and manage service accounts.
roles/iam.serviceAccountCreator,  Create Service Accounts,  Access to create service accounts.
roles/iam.serviceAccountDeleter,  Delete Service Accounts,  Access to delete service accounts.
roles/iam.serviceAccountKeyAdmin,  Service Account Key Admin,  Create and manage (and rotate) service account keys.
roles/iam.serviceAccountTokenCreator,  Service Account Token Creator,  Impersonate service accounts (create OAuth2 access tokens, sign blobs or JWTs, etc).
roles/iam.serviceAccountUser,  Service Account User,  Run operations as the service account.
roles/iam.workloadIdentityPoolAdmin,  IAM Workload Identity Pool Admin,  Full rights to create and manage workload identity pools.
roles/iam.workloadIdentityPoolViewer,  IAM Workload Identity Pool Viewer,  Read access to workload identity pools.
roles/iam.workloadIdentityUser,  Workload Identity User,  Impersonate service accounts from GKE Workloads
roles/iap.admin,  IAP Policy Admin,  Administrator of IAP Permissions
roles/iap.httpsResourceAccessor,  IAP-secured Web App User,  Access HTTPS resources which use Identity-Aware Proxy
roles/iap.settingsAdmin,  IAP Settings Admin,  Administrator of IAP Settings.
roles/iap.tunnelResourceAccessor,  IAP-secured Tunnel User,  Access Tunnel resources which use Identity-Aware Proxy
roles/identityplatform.admin,  Identity Platform Admin,  Full access to Identity Platform resources.
roles/identityplatform.viewer,  Identity Platform Viewer,  Read access to Identity Platform resources.
roles/identitytoolkit.admin,  Identity Toolkit Admin,  Full access to Identity Toolkit resources.
roles/identitytoolkit.viewer,  Identity Toolkit Viewer,  Read access to Identity Toolkit resources.
roles/integrations.apigeeIntegrationAdminRole,  Apigee Integration Admin,  A user that has full access to all Apigee integrations.
roles/integrations.apigeeIntegrationDeployerRole,  Apigee Integration Deployer,  A developer that can deploy/undeploy Apigee integrations to the integration runtime.
roles/integrations.apigeeIntegrationEditorRole,  Apigee Integration Editor,  A developer that can list, create and update Apigee integrations.
roles/integrations.apigeeIntegrationInvokerRole,  Apigee Integration Invoker,  A role that can invoke Apigee integrations.
roles/integrations.apigeeIntegrationsViewer,  Apigee Integration Viewer,  A developer that can list and view Apigee integrations.
roles/integrations.apigeeSuspensionResolver,  Apigee Integration Approver,  A role that can approve / reject Apigee integrations that contain a suspension/wait task.
roles/kuberun.eventsControlPlaneServiceAgent,  KubeRun Events Control Plane Service Agent,  Service account role used to setup authentication for the control plane used by KubeRun Events.
roles/kuberun.eventsDataPlaneServiceAgent,  KubeRun Events Data Plane Service Agent,  Service account role used to setup authentication for the data plane used by KubeRun Events.
roles/lifesciences.admin,  Cloud Life Sciences Admin,  Full control of Cloud Life Sciences resources.
roles/lifesciences.editor,  Cloud Life Sciences Editor,  Access to read and edit Cloud Life Sciences resources.
roles/lifesciences.serviceAgent,  Cloud Life Sciences Service Agent,  Gives Cloud Life Sciences Service Account access to compute resources. Includes access to service accounts.
roles/lifesciences.viewer,  Cloud Life Sciences Viewer,  Access to read Cloud Life Sciences resources.
roles/lifesciences.workflowsRunner,  Cloud Life Sciences Workflows Runner,  Full access to operate on Cloud Life Sciences workflows.
roles/livestream.editor,  Live Stream Editor,  Full access to Live Stream resources.
roles/livestream.viewer,  Live Stream Viewer,  Read access to Live Stream resources.
roles/logging.admin,  Logging Admin,  Access to all logging permissions, and dependent permissions.
roles/logging.bucketWriter,  Logs Bucket Writer,  Ability to write logs to a log bucket.
roles/logging.configWriter,  Logs Configuration Writer,  Access to configure log exporting and metrics.
roles/logging.fieldAccessor,  Log Field Accessor,  Ability to read restricted fields in a log bucket.
roles/logging.logWriter,  Logs Writer,  Access to write logs.
roles/logging.privateLogViewer,  Private Logs Viewer,  Access to view all logs, including logs with private contents.
roles/logging.serviceAgent,  Cloud Logging Service Agent,  Grants a Cloud Logging Service Account the ability to create Datasets and manage BigQuery Authorized Views inside those Datasets.
roles/logging.viewAccessor,  Logs View Accessor,  Ability to read logs in a view.
roles/logging.viewer,  Logs Viewer,  Access to view logs, except for logs with private contents.
roles/managedidentities.admin,  Google Cloud Managed Identities Admin,  Full access to Google Cloud Managed Identities Domains and related resources. Intended to be granted on a project-level.
roles/managedidentities.domainAdmin,  Google Cloud Managed Identities Domain Admin,  Read-Update-Delete to Google Cloud Managed Identities Domains and related resources. Intended to be granted on a resource (domain) level.
roles/managedidentities.peeringAdmin,  Google Cloud Managed Identities Peering Admin,  Full access to Google Cloud Managed Identities Domains and related resources. Intended to be granted on a project-level
roles/managedidentities.peeringViewer,  Google Cloud Managed Identities Peering Viewer,  Read-only access to Google Cloud Managed Identities Peering and related resources.
roles/managedidentities.serviceAgent,  Cloud Managed Identities Service Agent,  Gives Managed Identities service account access to managed resources.
roles/managedidentities.viewer,  Google Cloud Managed Identities Viewer,  Read-only access to Google Cloud Managed Identities Domains and related resources.
roles/mediaasset.serviceAgent,  Media Asset Service Agent,  Downloads and uploads media files from and to customer GCS buckets.
roles/memcache.admin,  Cloud Memorystore Memcached Admin,  Full access to Memcached instances and related resources.
roles/memcache.editor,  Cloud Memorystore Memcached Editor,  Read-Write access to Memcached instances and related resources.
roles/memcache.serviceAgent,  Cloud Memorystore Memcached Service Agent,  Gives Cloud Memorystore Memcached service account access to managed resource
roles/memcache.viewer,  Cloud Memorystore Memcached Viewer,  Read-only access to Memcached instances and related resources.
roles/meshconfig.serviceAgent,  Mesh Config Service Agent,  Apply mesh configuration
roles/meshdataplane.serviceAgent,  Mesh Data Plane Service Agent,  Run user-space Istio components
roles/metastore.admin,  Dataproc Metastore Admin,  Full access to all Dataproc Metastore resources.
roles/metastore.editor,  Dataproc Metastore Editor,  Read and write access to all Dataproc Metastore resources.
roles/metastore.metadataOperator,  Dataproc Metastore Metadata Operator,  Read-only access to Dataproc Metastore resources with additional metadata operations permission.
roles/metastore.serviceAgent,  Dataproc Metastore Service Agent,  Gives the Dataproc Metastore service account access to managed resources.
roles/metastore.user,  Dataproc Metastore Viewer,  Read-only access to all Dataproc Metastore resources.
roles/ml.admin,  AI Platform Admin,  Full access to AI Platform.
roles/ml.developer,  AI Platform Developer,  Access to create training and prediction jobs, models and versions, send online prediction requests.
roles/ml.jobOwner,  AI Platform Job Owner,  Full access to the job.
roles/ml.modelOwner,  AI Platform Model Owner,  Full access to the model and its versions.
roles/ml.modelUser,  AI Platform Model User,  Permissions to read the model and its versions, and use them for prediction.
roles/ml.operationOwner,  AI Platform Operation Owner,  Full access to the operation.
roles/ml.serviceAgent,  AI Platform Service Agent,  AI Platform service agent can act as log writer, Cloud Storage admin, Artifact Registry Reader, BigQuery writer, and service account access token creator.
roles/ml.viewer,  AI Platform Viewer,  Read-only access to AI Platform resources.
roles/monitoring.admin,  Monitoring Admin,  All current and future monitoring permissions.
roles/monitoring.alertPolicyEditor,  Monitoring AlertPolicy Editor,  Read/write access to alerting policies.
roles/monitoring.alertPolicyViewer,  Monitoring AlertPolicy Viewer,  Read-only access to alerting policies.
roles/monitoring.dashboardEditor,  Monitoring Dashboard Configuration Editor,  Read/write access to dashboard configurations.
roles/monitoring.dashboardViewer,  Monitoring Dashboard Configuration Viewer,  Read-only access to dashboard configurations.
roles/monitoring.editor,  Monitoring Editor,  Read/write access to all monitoring data and configuration.
roles/monitoring.metricWriter,  Monitoring Metric Writer,  Write-only access to metrics.  This provides exactly the permissions needed by the Stackdriver agent and other systems that send metrics.
roles/monitoring.metricsScopesAdmin,  Monitoring Metrics Scopes Admin,  Access to add and remove monitored projects from metrics scopes.
roles/monitoring.metricsScopesViewer,  Monitoring Metrics Scopes Viewer,  Read-only access to metrics scopes and their monitored projects.
roles/monitoring.notificationChannelEditor,  Monitoring NotificationChannel Editor,  Read/write access to notification channels.
roles/monitoring.notificationChannelViewer,  Monitoring NotificationChannel Viewer,  Read-only access to notification channels.
roles/monitoring.notificationServiceAgent,  Monitoring Notification Service Agent,  Grants permissions to deliver notifications directly to resources within the target project, such as delivering to Cloud PubSub topics within the project.
roles/monitoring.servicesEditor,  Monitoring Services Editor,  Read/write access to services.
roles/monitoring.servicesViewer,  Monitoring Services Viewer,  Read-only access to services.
roles/monitoring.uptimeCheckConfigEditor,  Monitoring Uptime Check Configuration Editor,  Read/write access to uptime check configurations.
roles/monitoring.uptimeCheckConfigViewer,  Monitoring Uptime Check Configuration Viewer,  Read-only access to uptime check configurations.
roles/monitoring.viewer,  Monitoring Viewer,  Read-only access to get and list information about all monitoring data and configuration.
roles/multiclusteringress.serviceAgent,  Multi Cluster Ingress Service Agent,  Gives the Multi Cluster Ingress service agent access to CloudPlatform resources.
roles/multiclustermetering.serviceAgent,  Multi-cluster metering Service Agent,  Gives the Multi-cluster metering service agent access to CloudPlatform resources.
roles/netappcloudvolumes.admin,  NetApp Cloud Volumes Admin,  This role is managed by NetApp, not Google.
roles/netappcloudvolumes.viewer,  NetApp Cloud Volumes Viewer,  This role is managed by NetApp, not Google.
roles/networkconnectivity.hubAdmin,  Hub & Spoke Admin,  Full access to Hub and Spoke resources.
roles/networkconnectivity.hubViewer,  Hub & Spoke Viewer,  Read-only access to Hub and Spoke resources.
roles/networkconnectivity.spokeAdmin,  Spoke Admin,  Create Spokes and attach them to an existing Hub.
roles/networkmanagement.admin,  Network Management Admin,  Full access to Network Management resources.
roles/networkmanagement.serviceAgent,  GCP Network Management Service Agent,  Grants the GCP Network Management API the authority to complete analysis based on network configurations from Compute Engine and Container Engine.
roles/networkmanagement.viewer,  Network Management Viewer,  Read-only access to Network Management resources.
roles/notebooks.admin,  Notebooks Admin,  Full access to Notebooks all resources.
roles/notebooks.legacyAdmin,  Notebooks Legacy Admin,  Full access to Notebooks all resources through compute API.
roles/notebooks.legacyViewer,  Notebooks Legacy Viewer,  Read-only access to Notebooks all resources through compute API.
roles/notebooks.runner,  Notebooks Runner,  Restricted access for running scheduled Notebooks.
roles/notebooks.serviceAgent,  AI Platform Notebooks Service Agent,  Provide access for notebooks service agent to manage notebook instances in user projects
roles/notebooks.viewer,  Notebooks Viewer,  Read-only access to Notebooks all resources.
roles/oauthconfig.editor,  OAuth Config Editor,  Read/write access to OAuth config resources
roles/oauthconfig.viewer,  OAuth Config Viewer,  Read-only access to OAuth config resources
roles/ondemandscanning.admin,  On-Demand Scanning Admin,  All permissions for On-Demand Scanning
roles/opsconfigmonitoring.resourceMetadata.viewer,  Ops Config Monitoring Resource Metadata Viewer,  Read-only access to resource metadata.
roles/opsconfigmonitoring.resourceMetadata.writer,  Ops Config Monitoring Resource Metadata Writer,  Write-only access to resource metadata. This provides exactly the permissions needed by the Ops Config Monitoring metadata agent and other systems that send metadata.
roles/orgpolicy.policyAdmin,  Organization Policy Administrator,  The permission to set Organization Policies on resources.
roles/orgpolicy.policyViewer,  Organization Policy Viewer,  Access to view Organization Policies on resources.
roles/osconfig.guestPolicyAdmin,  GuestPolicy Admin,  Full admin access to GuestPolicies
roles/osconfig.guestPolicyEditor,  GuestPolicy Editor,  Editor of GuestPolicy resources
roles/osconfig.guestPolicyViewer,  GuestPolicy Viewer,  Viewer of GuestPolicy resources
roles/osconfig.instanceOSPoliciesComplianceViewer,  InstanceOSPoliciesCompliance Viewer,  Viewer of OS Policies Compliance of VM instances
roles/osconfig.inventoryViewer,  OS Inventory Viewer,  Viewer of OS Inventories
roles/osconfig.osPolicyAssignmentAdmin,  OSPolicyAssignment Admin,  Full admin access to OS Policy Assignments
roles/osconfig.osPolicyAssignmentEditor,  OSPolicyAssignment Editor,  Editor of OS Policy Assignments
roles/osconfig.osPolicyAssignmentViewer,  OSPolicyAssignment Viewer,  Viewer of OS Policy Assignments
